Goods Description,Commodity Code
"el anr, night bounce, overnigh",33049900
"elnetthairspray200ml, unperfum",33053000
"mineral fuels, mineral oils and products of their distillation; bituminous substances; mineral waxes - gear oils and reductor oils",27101987
"sure apd's 150ml, cotton",33072000
1 bottle,39241000
100ml bottle,39233010
17 dp hny lp blm 2.5g,33041000
17 mallow sponge,3924900090
1x admiral plug &amp; drive,85269120
2 x air wick freshmatic automati,96161090
25 ttl eye lft tst unt pri bs1,33049900
25 ttl eye lft tst unt pri hd1,33049900
25 ttl eye lift floor twr 1=1,33049900
2pk boys' regular leg school t,62034319
3pk girls' easy iron school sh,62064000
Lip make-up, 3304100000
Lipstick, 3304100000
a5 card,48070080
adapter,85366990
adapters,85366990
alberto balsam ccnt&lychee sha,33051000
albrto blsm snkssd rspbrry shm,33051000
always dailies f&w normal fres,96190040
always diles pnty lners nrmal,96190040
always discreet liner plus 20s,96190040
always discreet liners 24s,96190040
always discreet pants normal m,96190089
always ds panty liners long+un,96190040
always infinity night 10s,96190040
always infinity normal 12s,96190040
always platinum value pack siz,96190040
always sensitive normal plus p,96190040
alwys ultr sntry scrnght xtraw,96190040
alwys ultr sntry scrnght xtraw,96190040
alwys ultrsry twls dy&nght w w,96190040
alwysultr sntry twls lng wth w,96190040
alwysultr sntrytwls nght wthwn,96190040
ambre ideal bronze mlk spray s,33049900
ambre solair spr uv invsbl stk,33049900
anthelios uv mune invisible sp,33049900
aosept hydglyde contact lens s,33079000
apron,62114210
apron,63079098
apt 1 1st formula liquid birth,19011000
apt 2 foll on milk liquid 6-12,19011000
apt adv 2 follow on powder 6-,19011000
aptamil 1 fim formula powder 1,19011000
ariana grande r.e.m. cherry ec,33030010
arkive the good habit hybrid o,33059000
arm and hammer advance white t,33061000
aussie insurance conditioning,33059000
avno fce clm & rstre oat srm 3,33049900
b&h edit bwash vanilla seducti,34013000
b&h edit hand wash cherry temp,34013000
b&h hw eng lavender & chamomil,34013000
b&h sig lavender & geranium hw,34013000
babyeinstein calaplw tummy tim,95030099
bang bang chicken - kit,21039090
barry m gelly nail paint grape,33043000
basets multi vits 3-6 strawber,21069092
batteries,85068080
baylis & harding hw man&grapef,34013000
bazuka,30049000
beads,39269097
beads,70181011
belt,42033000
belt,42033000
benzene crude,27071000
benzene pure,2902200000
bionsen japanese spa deodrnt s,33072000
biore uvaqua rch wtr esssnscn,33049900
blink intensive triple action,30049000
bluey sunsafe blue 104,61124190
board,33072000
bobbibrownfndtn stck beige 9g,33049900
bodyform string panty liners 2,96190040
boj glw dp srm rice alpha arbu,33049900
boj mt sn stck mgwrt cml spf50,33049900
boj rve eye srm gnsng and rtnl,33049900
boj rve eye srm gnsng and rtnl,3304990000
bondi sands techno tan emerald,33049900
boots baby bath,33073000
boots baby fragranced nappy ba,39232100
boots baby fragranced nappy ba,39232100
boots baby head to toe wash 50,34013000
boots baby sterilising liquid,34025090
boots baby ultra soft baby spo,33051000
boots balsam tissues 3ply 80s,48182010
boots bio cleans wipes cucumbe,33049900
boots bio cleans wipes cucumbe,34011900
boots blister plasters mixed s,30051000
boots bodypolisher white,39249000
boots bodypolisher,33049900
boots bump & beyond bump sheet,33079000
boots complete man 30 tablets,21069092
boots everyday hand wash cocon,34013000
boots everyday hand wash lime,34013000
boots everyday shower gel berr,34013000
boots everyday ss ey mkeup rmv,33049900
boots extra firm hold hairspra,33053000
boots foot socks coconut oil,33079000
boots glow singe sided mitt,96162000
boots high strength vitamin b,21069092
boots ingred hyaluronic acid m,33049900
boots ingredients hyaluronic a,33049900
boots ingredients peptide seru,33049900
boots jaw clip non slip black,96151100
boots little stories bamboo na,96190050
boots massage sponge charcoal,39249000
boots mens washbag black,42021219
boots multi pocket tissues 6s,48182010
boots p12 purple beauty bag 62,33049900
boots p12 purple beauty bag 62,42029211
boots pharmaceuticals cranberr,30049000
boots pregnancy test 2s,38221900
boots pregnancy tests,3822190090
boots sk salicylic acid blmsh,33049900
boots ss shower cap,65069100
boots standard ponybands blond,62171000
boots staydry pads maxi night,96190040
boots staydry pads maxi plus 1,96190040
boots staydry pads maxi plus 1,9619007100
boots travel spray bottle 100m,39233010
boots u soft tissues 3ply brus,48182010
boots ultra towels night wing,96190040
boots ultra towels normal wing,96190040
boots unperfumed hairspray ext,33053000
boots white tissues 2 ply box,48182010
botanics globe roller 2s,33049900
bright starts oball classic ea,95030095
brio frwl frizz mlk lve in spr,33059000
brush,96031000
brush,96031000
brush,96032930
bs selftan fm 1hr exp ult drk,33049900
btncs 100_ orgc nurshng fcl ol,33049900
btncs all bght prfyg fc scb nt,33049900
btncs all brght rdnc fc srm nt,33049900
btncs glw fcl ol ntrl & vit c,33049900
bts baby soo snsitive wtr wps,34011100
bts bio wipes anti 12s,34025010
bts cmpct csmtc spgs 2s,39249000
bts flt edg spnge,96162000
bts ibs wnd&bltng rlf smtcn125,30049000
bts jaw clips mixed black/tort,96151100
bts para 500 cplt long 16 g (1,30049000
bts para 500 tab round 16 g (1,30049000
bts para tb 32,30049000
bts pharma corn removal plaste,30049000
bts sd active stretch nappy jn,96190081
bts sheet mask with added coll,33079000
bts smll csmtc clr pvc bg flw,42021219
bts smooth care 5 blade dispo,82121010
bts smth cre hr rmv crm fce fs,33049900
bts trad glyc & rosewtr new fo,33049900
btspharmastaydrydisposablebedp,63029990
btste dry shmpoo original 350m,33051000
calpol 6 years+ suspension 80m,30049000
calpol 6yrs+ s-f sachets 12 (1,30049000
cantu wghtls shmpo cndtnr duo,33051000
cap,65050030
cards,49090000
carex advanced care hw sea min,34013000
carmex cherry tube,33041000
carmex minis 5g 3s,33041000
carpet,57024200
centrum womens 50+ 30s,21069092
cerave hydrtng clnsr rfill pch,33049900
chanel chance in order smp 3ml,33030090
chanel le vol wpf masc noir 6g,33042000
charger,85044060
childs farm sp50+ suncream 100,33049900
chocolate,18062010
cillit bang hair drain unblocker,34025090
cillit bang hair drain unblocker,34025090
clarins 25 boots big beauty gi,33049900
clarinshydraessentielcrmspf15,33049900
clearblue digital twin pregnan,38221900
clearblue preg test visual ult,38221900
clinique high impact zero grav,33049900
clothespin,39249000
clothespin,39269097
cloths,63071030
cloths,63071030
cloud nine the touch iron gold,85163200
coco & eve sunny honey bali br,33049900
coffee,21011292
collar,4201000090
collection hydrtng lpstk rs ch,33041000
collection lp sl pwdr 2 transl,33049100
collection lpc 5 fair,33049900
collection vlvt crm blshr sh1,33049900
compeed corns med 10pc,30051000
compression bag,39269097
computer parts,84733080
corsodyl dailly ultra clean t/,33061000
cosrx advanced snail 92 allin1,33049900
cosrx advanced snail 96 mcin p,33049900
cotton white stazon on pad,96122000
cow and gate first big pack 1,19011000
crlsmth crl dfnng stylng sffle,33059000
crude benzene,27071000
crude toluene,27072000
cup,39241000
cup,39241000
cup,69120021
cw snshne uv prtctn leave-in s,33059000
cw volume&bounce bdy booster,33051000
cw volume&bounce prfect finish,33053000
deeds,49119900
delisted-loreal men expert h,33049900
denman headhugger small,96032930
depilator,85103000
dior addctlpglwoil 012 rosewod,33041000
dior diorshow 5 coleur l/e 557,33042000
dior sauvage fathers day duo k,33030010
dior sauvage fathrsd artofgift,33030010
document,49119900
documents,49119900
doorstop,40169997
dots for spots blmsh ptch hydr,33049900
dove adv antip deo invisible c,33072000
dove adv antip deo pomegranate,33072000
dove adv apd dragon frt conut,33072000
dove adv apd dragon frt conut,3307300000
dove adv roll on passion fruit,33072000
dove apd classic fresh stick 5,33072000
dove ds summer revived fair to,33049900
dove liqhandsoap refill dp nrs,34013000
dove maximum prct crem deo pme,33072000
dove men bw clean comfort 250m,34013000
dove pkbeaut barsoap mstrsing,34011100
dr jart+ cicapair tiger grass,33049900
dr wolff's v-san protective oi,33049900
dream filter,33049900
dried pineapples,0804300010
drinks sachets,21069098
drizzilicious mini rice cake b,19049010
drunk elephant bora barrier cr,33049900
drynites pj pants jumbo girl 3,96190081
e.l.f clr brw & lsh mscr 2.5ml,33042000
e.l.f. cm lqd blsh bold faced,33049900
e.l.f. halo glw lqd fltr 0.5 f,33049900
e.l.f. hlo glo lquid filtr 1 f,33049900
e.l.f. instnt lft wp brw pncl,33042000
e.l.f. o fs lpstck stndng ov p,33041000
ee equipment returns (na),85176200
ek ban & coco pou stg 1 120g,20071010
ek blu app ban van pou 120g st,20071010
ek melt puff tom & leek 20g st,19041010
el doublewear lengthening masc,33042000
el dw liquid mup new rattan 2w,33049900
el futurist rscue mkup 3n1 ivo,33049900
el resilience mlt eft ec ask s,33049900
el stay in plce found 1w0 warm,33049900
el stay in plce found 2w1.5 na,33049900
el supreme+ cell power mstrsr,33049900
elast w/p pls 40,30051000
elauder dbl wr stay in pl prce,33049900
elauder dble wr stay in place,33049900
elauder dwr wtrp e/lnr graphit,33042000
elauder mini sump ext2.8ml,33049900
eldoublewear desertbge,33049900
eldoublewear desertbge,33049900
eldoublewear fresco,33049900
eldoublewear ivory,33049900
eldoublewear ivory,33049900
eldoublewear palealmo,33049900
eldoublewear05 ecru,33049900
eldoublewear05 ecru,33049900
eldoublewear05 shell,33049900
eldoublewear05 tawney,33049900
eldoublewear05 wheat,33049900
electrical capsule,85391000
elf glw rvvr lp ol crystl clr,33041000
elf glw rvvr lp ol rs nvy 7.6m,33041000
ella's kitchen melty sticks ch,19041010
ella's kitchen melty sticks pc,19041010
ella's kitchen tom & bas melty,19041010
ella's prunes prunes prunes st,20071010
elvive colour protect purple s,33051000
elvive dream lengths ht prtct,33051000
estrid starter kit bloom,82121090
eucerin sungel crmkid drytch s,33049900
eylure dybrow brown,33059000
fabric sample,63079098
fan,84145100
fan,84145100
fancy dress,95059000
fence,44219999
fenty glss bmb uni lp lumi fu$,33041000
fixodent plus unbeatable bite,33069000
florl st wonderland peony edp,33030010
foot pads,30059010
footmender all in one diabetic,33049900
frida baby control the flow ri,39249000
frida mom dsposable pstprtum u,96190089
frida mom perineal healing foa,30049000
frida mom perineal healing foa,33049900
frida mom upside down peri bot,39249000
fridababy medifrida accu-dse s,40170000
fridababy the flakefixer crade,96151900
garnier as snstve advncd bdy s,33049900
garnier as supruv dly fce mst,33049900
garnier as supruv dly fce mst,33049900
garnier micellar wtr fcl clns,33049900
garnieras snsv advcd kds mst s,33049900
gem dissolvable whiteningstrip,33069000
gem skin lvg apd coconut vanil,33049900
gem skin lvg apd coconut vanil,33072000
gillette blue ii plus slalom d,82121010
gillette simply venus 2 disp r,82121010
gillette venus satincare dry s,33071000
gillette venus spa breeze blad,82121090
gillette venus spa breeze blad,8212200000
gillette venus tropical dispos,82121010
givnchy blck pch&gntlmn scty e,33030010
glitter,39269097
gnr sa bbcrm clsc ttd mtsr spf,33049900
got2b glued blasting freeze sp,33053000
got2b powder'ful vol sty pdr 1,33059000
grin dble floospyx dntl floss,33062000
grln absls allgra rsa vrde edt,33030090
grnr sknactve brghtning vi c d,33049900
grnr sknactve brghtning vit c,33049900
gvenus satincare sensitive 200,33071000
h coolwater woman edt 50,33030090
h&h prmenopse mltntrnt spprt s,21069092
h&s drma x pro snstv shmpoo 30,33051000
h/o a/c/d 120tabd 120tab,21069092
haberdashery,73199090
haliborange softies iron 30s,21069092
haliborange younger minds nigh,21069092
handheld portable electric iro,85164000
handvalise,42021219
handvalise,42021299
hawaiian tropic body btter coc,33049900
hawaiian tropic silk hydrat sp,33049900
hc45 hyd crm 15g (p),33049900
head & shoulders supreme colou,33051000
head and shouldrs sclp mssge b,33051000
heygates flubenvet layers pellet,23099051
hipp organic porridg bana&blue,21042000
house number,39269097
hrbl essncs chmomle lve on trt,33059000
huda easy bake setting spray m,33049900
huggies bw natcare plstc free,34011100
huggies drynites pyj pnts cp b,96190050
hype pink/turquoise pastel poo,42029291
il fmbrst bdy wsh mllw chrry b,34013000
il foambrst bdy wsh jsmn vnll,34013000
imedeen prime renewal 120,21069092
imperial leather bw mandarin &,34013000
ineos hndwsh rhubard & tonka 5,34013000
infacol liquid 55ml,30049000
infacol liquid 85ml,30049000
inkey list omga wtr crm mstrsr,33049900
ivory swatch,63079098
jeans set,62046231
jf fe straight cond250,33059000
jf fe straight spoo250,33051000
jf luxorious volume fev full h,33051000
jf volume lift root booster 12,33059000
jhn frieda frzz e drm c hydrt,33059000
johnsons kids no more tangles,33059000
joie spin 360 0+/1 ember,9401800000
joss stick,33074100
joss stick,3406000000
joules hanging washbag,42021219
joules travel giftset,33049900
jpg scandal ph edpi trvel spra,33030010
jumpsuit,62114390
jungle formula aerosol max any,38089190
jungle formula maximum roll on,38089190
jungle formula plug-in,38089190
jungle formula pump spry mx an,38089190
kendamil clas 1st inf frm brth,19011000
kendamil fi gt mlk 0 to 6 mont,19011000
kendamil fi gt mlk 0 to 6 mont,19011000
kendamil organic follow-on mil,19011000
kendamil porridge apple & blac,21042000
kendamil toddler mlk stg3 12to,19011000
key chain,73262000
key chain,73262000
keychain,73262000
keychain,73262000
keychain,73262000
keychain,73262000
keychains,73262000
keyring,73262000
kiddylicious strawberry wiggle,20089798
kiddylicious strawbrry&ban mel,20089798
kiehl's heroes gift set x24,33049900
king,63023100
king,63023100
kleenex blsm ext l ts sng cm b,48182010
kleenex blsm ext l ts sng cm b,48182010
kwells tabs 12 (p),30049000
ky jelly 113g,30067000
l oreal men expert carbon pr,33072000
l'orl prs tr mtch cnclr srm 1,33049900
l^ renergie mult lift night 50,33049900
la rche pos baby anthelios mil,33049900
label,48219090
ladies dress,62044200
lamp,94052140
lanc gld tan max aftr sun ltn,33049900
lanc gld tan max aftr sun ltn,33049900
laptop,8471300000
laptops,8471300000
laundry pod,34025090
laundry pod,34025090
le superskin adv nourshng clea,33049900
lee stafford coco loco blow an,33059000
lee stafford coco loco heat pr,33059000
lee stafford coco loco mousse,33059000
lee stafford hair up styling b,33059000
leggings,61046200
leggings,6104630000
lemsip max c&f blkcurant sch 1,30049000
lens,90021900
lights by tena liner 24s,96190089
linen blend culottes with belt,62046390
liq iv hydra drk mx lem lime s,21069092
liz e sr light crm 50ml portfo,33049900
liz e sr light crm 50ml portfo,33049900
liz earle orange flower hand w,34013000
loreal faux brw tnt, dark brun,33042000
loreal me deo spry hydreng ext,33072000
loreal paris elvive dream le,33051000
loreal paris elvive dream le,33051000
lost mary bm6000 refillable ki,85434000
lp rvtlft clncl vtmn c uv fld,33049900
lp se absolut repair condition,33059000
lp true match foundation vanil,33049900
lrl elvv glyclc glss lve in sr,33059000
lrp anthelios invis sun crm sp,33049900
lrp anthelios uvmune fc&bdy lt,33049900
lrp anthls uvmn 400 hydrt crm,33049900
lrp anthls uvmn 400 hydrt crm,33049900
lrp hydrphs uv intns rch mstrs,33049900
lrp tolern clnsng fm gel dbl c,33049900
lumene illumi dewy setting spr,3304990000
luminous ornaments,94054940
luminous ornaments,94056920
lynx attract for her the sidekic,33072000
lynx bs mini africa 35ml,33072000
lynx ice chill apd spray 250ml,33072000
lynx lwr bdyspry coconut sndlw,33072000
m1 clean and protect,34025010
mac macstack waterproof mascar,33042000
maclip duo kitvelvet teddy,33041000
makhani - kit,21039090
mam night ast 16+ mnths sthr 2,40170000
mam teat 1 (slow flow),39241000
mamas & papas armadillo pushch,87150010
maybelline cb mcra very black,33042000
maybelline colossal bubble w,33042000
maybelline skyhigh mascra wate,33042000
maybelline skyhigh mascra wate,33042000
mbm bb crm blshr strawberry cr,33049900
mf fcfnty ref cmp fndtn ivory,33049900
mf nailfinity np the finale,33043000
mielle rsmy mnt clrfg sclp scb,33059000
milton sterilising fluid 500ml,34025090
milwakee usb,85044095
mitchum adv roll on apd pwder,33072000
mitchum adv roll on flower fre,33072000
mitchum advance stick apd pwdr,33072000
mitchum ultimate clean cotton,33072000
mlc perfect peach curling cust,33059000
mny bld a brw ash brwn 1.65ml,33042000
mny lftr plmp glss blsh blze 5,33041000
mny lftr plmp glss pnk stng 5,33041000
mny mas volm'express clssl 100,33042000
mny sunkisser blush 03 sol sea,33049100
mothercare patterned muslin cl,63079098
mounjaro (tirzepatide) injecti,30043900
mounjaro (tirzepatide),30043900
mounjaro (tirzepatide),3004390000
mozzipatch famadv antimos ptch,38089190
mug,69120029
munchkin maxi secure safety ga,73269098
my expert midwife peri prep bi,33049900
my little coco mama bump butte,33049900
my little coco sleepy head bub,33073000
my little sudocrem 22g,30049000
myb pwdr fit me mat prless 90,33049100
mylee 3 half-moon double sided,82142000
nars nr longwear foundation ba,33049900
nasal truss,90219090
nelsons teetha g,30049000
ng hb water gl clnsr frgnc-fr,33049900
nicorette inhal cartridges 15m,24041200
nicorette quickmist duo pack (,24049110
nicsalt,24021200
nivea deo black & white power,33072000
nivea f/m rev q10 crm50,33049900
nivea fc srm clulr exprt zn lf,33049900
nivea fce exfltr drma skn clr,33049900
nivea sun snstve sthing spry s,33049900
nivea sunuv fccrm spcl pmrsrm,33049900
nivea visage essentials norm/c,33049900
niveasun ultlghtfld lghttint s,33049900
no7 airbsh away colour balanci,33049900
no7 airbsh away pore minimisin,33049900
no7 buildable coverage foundat,33049900
no7 flawless loose pwd translu,33049100
no7 future renew def shield sp,33049900
no7 l&l triple action primer 3,33049900
no7 men p&p intense advanced s,33049900
no7 p&pi advanced recvry after,33049900
no7 p&pia all in one fdn cool,33049900
no7 pa uts highlighter gold gl,33049100
no7 r&r f&n multi action eye c,33049900
no7 stay perfect fdn porcelain,33049900
no7 stay perfect fdn warm beig,33049900
nordic c valo glw renw nght sr,33049900
notebook,48201030
notebook,48201030
notebook,48201030
notebook,48201030
nrsm hnd cr mini st,33049900
nuby animal adven tum time wat,95030041
nuxe hp roll on gold 8ml gwp,33049900
nv fc srm lmnus630 ant-age&drk,33049900
nyx iv srm gloss grape gushin,33041000
nyx pm ult shdw plt vntge jean,33042000
nyx pmu bter gls lip gls bg sp,33041000
nyx pmu btr gls lp gls drpd ou,33041000
nyx pmu btr gls lp gls she gt,33041000
nyx pmu btrmlt blsh bta tgthr,33049100
nyx pmu btrmlt brnzr bt me up,33049900
nyx pmu btrmlt brnzr butta cup,33049900
nyx pmy bwm cclr fair,33049900
o'keeffe's working hands hb bo,33049900
ob vpro e rech toothbrushe blk,85098000
ogx bnd prtn rpair heat prtct,33059000
ogx bnd prtn rpair heat prtct,33059000
olia 6.0 light brown,33059000
opi rapidry - secs appeal,33043000
optase tto lid wipes 20s,34011100
oral-b io2 tbrush calm pink tr,85098000
oral-b io2 tbrush night black,85098000
ordo sonic kds bttry tb sqshml,85098000
organix weaning wands banana 2,19041010
original source sg coconut/she,34013000
oss-topper-double,94049090
oss-topper-double,94049090
oss-topper-king,94049090
pa invsbl pmpl ptch 22 pck,33049900
pack of 1 a)catsan 20ltrs,38249996
pack of 6 girls knee high bow,61159500
paint,33049900
pamp nb harmonie plstc free wp,34011100
pamp prem protect npnt pk sz 6,96190081
pamp prem protect npnts pk sz,96190081
pamp prem protect pk sz 4 jumb,96190050
pamp prem protect pk sz 5 jumb,96190081
pamp prem protect pk sz 6 jumb,96190081
pamp prem protect pk sz 6 jumb,96190081
pampers bd pants essential siz,96190081
pantene colour protect conditi,33059000
pantene core clssc cln 3in1 sh,33051000
pantene repair & protect cndit,33059000
pants,61071100
pants,61071100
pants,61071100
pants,61071100
patchology bs rstrng night hyd,33049900
peachtoned corrector stick,33049900
pears,08083090
pen,96081010
penne alla rustica - kit,19021100
pens,96081010
perfluorooctane sulphonyl fluoride,2904360000
philips sc pres 9900 sense iq,85098000
phoenix 18pk 2-ply white (72 rolls),48181010
piece of cake,19059070
pixi on the glw crm brnzer ric,33049900
piz buin tan intensifier ltn s,33049900
plantur 39 antigry ffct cond 1,33059000
plantur39 anti-grey effect sha,33051000
plastic medicine box,39249000
plastic toothbrush,9603210000
pntene mrcles slky & glwg shmp,33051000
pntn bnd rpr mrcl hr crm 90ml,33059000
pntn mrcls bnd rpr prtctng shm,33051000
pots,69149000
prai aglss thrt & dclltg crm s,33049900
prd ln rss edp 9ml gwp,33030010
proceive men max sachets 30s,21069092
purchase orders,49119900
pure benzene,2902200000
pure toluene,2902300000
quilts,94044090
rabanne 1 million 50ml edt,33030010
radox men feel invgortd shwr g,34013000
raincoat,62014010
rayhong automobile coating spr,34025010
raylo screen wipes,34025010
redken acidic bonding conce co,33059000
remington h9100 proluxe heated rollers 20 rollers and clips 8x 25mm and 12x 32mm,85163200
remington h9100 proluxe heated rollers 20 rollers and clips 8x 25mm and 12x 32mm,8516320000
remote control,85437090
remote,85437090
rennie spearmint 72s (g),30049000
rev biglash reldd vol mscra ul,33042000
rev ccl + defne cclr c12.5,33049900
rev sprbase clr crrctng grn pr,33049900
rev superlustrous lpstck dirty,33041000
rev superlustrous lpstck unct,33041000
rev suprdwy liqud blsh flushin,33049900
rev suprdwy liqud blsh you hd,33049900
rev wrap lash tbng mscr brwn 8,33042000
revolution duo brw dfner drk b,33042000
revolution pro miracle night s,33049900
revolution the icons minis mom,33049900
rim extrasuperimashmascara bla,33042000
rim hidetheblemishconc ivory,33049900
rim multitask cclr fair,33049900
rim multitask cclr ivory,33049900
rim softkholeyepencil sablebro,33042000
rimmel multi tasker all day gr,33049900
rimmel multi tasker setting sp,33049900
rimmel thrll skr glsy gls 100,33041000
rimmel thrllskr extr mscr 001,33042000
ring,71179000
ring,71179000
ring,71179000
ring,71179000
rituals trial set karma 2023,33049900
rt 2 in 1 powder puff & case s,33049100
s&g pomegranate & hylrnc acd s,33049900
s&g spd plmp mrcl mstr hyd gl,33049900
safe & sound 7 day pill remind,39249000
sally hansen double duty base,33043000
sanctuary spa signature rich h,33049900
sanex expert sh sensitive show,34013000
sanex_roll_on, sensitive2,33072000
sba satinsilklngwrfndatn light,33049900
sdj brzln csh prfm mist cheiro,33030090
sdj brzln csh prfm mst cheiros,33030090
sdj brzln csh prfm mst cheiros,33030090
sea breeze,34060000
sensodyne pronamel gentle whit,33061000
sensodyne pronamel gentle whit,33061000
sensodyne rapid relief travel,33061000
sensodyne rapid relief travel,33061000
sequins,39299097
shapermint essentials high wai,6104630000
shapermint essentials scoop ne,6109902000
shark cryoglow undreye clng le,85437090
shelled walnuts,0802320000
shis vtl prfctn u&f adv crm re,33049900
shortdresses_girls_new,62044300
shorts,62034290
shorts,62034290
shorts,62034290
shorts,6203429000
shrk flxstyl 4in1 strghtwvy st,85163100
simp conditioning emur,33049900
simple cleansing biodgrdble wi,33049900
simple cleansing biodgrdble wi,33079000
simple express glow clay polis,33049900
skin1004 mdagscr cntl ampl fm,33049900
skirt,62045300
sltn actv 2in1 fce crm&lp stk,33049900
sltn kds sncre tsp & mstrs spf,33049900
snickers,18063100
sol de janeiro beija flor jet,33049900
sol de janeiro bom dia jet set,33049900
soltan kids once 8hr play spr,33049900
soltan kids pro mst roll ltn s,33049900
soltan kids pro mst roll ltn s,33049900
soltan s&c aftersun mist 200,33049900
soltan sensitive prtct spryspf,33049900
soltankidssnstiveprtctspryspf5,33049900
soltanonceadv8hrprtctltnspf50+,33049900
soltansensprotectlotionspf50+2,33049900
splesh 12 rolls quilted wate,48181010
st trop grad tan bdy ltn wtrml,33049900
st trop grad tan clssc bdy ltn,33049900
st tropez bronzing mousse 120m,33049900
stationey,48173000
sticker,49089000
sticker,49089000
sticker,49089000
sticker,49089000
sticker,49089000
stickers,49089000
stickers,49089000
stop n'grow stop biting,33043000
storage rack,94032080
storage rack,94037000
strappy top,61089100
strappy top,62089200
straw,4823908580
stroganoff - kit,21039090
supplements,21069092
sure bright bouquet roll on 50,33072000
sure bright bouquet roll on 50,33072000
sure cotton dry roll on 50ml,33072000
sure fm whl body deo stick ocn,33072000
sure for men non stop stick se,33072000
sure fw max pro atiprs cln sct,33072000
sure fw nstp antipers brgt bou,33072000
sure men apd invisible ice 200,33072000
sure men apd ro nonstop invis,33072000
sure men apd spray quantum dry,33072000
sure non stop pure melon & alo,33072000
sure ns apd vital cnut lotus f,33072000
sure w max pro anti persp deo,3307200000
sv10.5 mini tin alomomola + a,95049080
sv10.5 mini tin garbodor + am,95049080
sv10.5 mini tin krookodile +,95049080
sv10.5 mini tin mienshao + kl,95049080
sv10.5 mini tin volcarona + e,95049080
swatch,63079098
swatch,63079098
systane ultra 10ml,30049000
t shirt,61091000
tampax compak pearl tampns sup,96190075
tampax compak super plus tampo,96190040
ted baker mens everyday event,33030090
ted baker peony & camellia bod,33072000
tena lady maxi 6s,96190089
tena silh pnts plus lrg high w,96190089
the doux mss df 207ml,33059000
the inkey list azelaic acid 10,33049900
the inkey list repair, plump m,33049900
the ordinary the most-loved se,33049900
thumb wall hook,73181300
tights,61152100
tights,61152100
tmoon peaceful flower shower g,34013000
toluene crude,27072000
toluene pure,2902300000
tommee tippee groegg 2 usb the,90251900
tommee tippee insulated sporte,39241000
tommee tippee sangenic twist &,39249000
tommee tippee sangenic twist n,39249000
toothbrush,9603210000
top,61091000
top,61091000
towel,63026000
towel,63026000
towel,63026000
towel,63026000
trainers,64031900
transition guide,49019900
